{
  "$schema": "https://json-schema.org/draft/2020-12/schema",
  "$id": "https://fxdeck.dev/schema/effect-v1.json",
  "title": "FXDeck Effect Schema V1",
  "type": "object",
  "additionalProperties": false,
  "required": ["schemaVersion", "id", "durationMs", "layers"],
  "properties": {
    "schemaVersion": { "const": 1 },
    "id": { "type": "string", "pattern": "^[a-z][a-z0-9-]{1,63}$" },
    "label": { "type": "string", "maxLength": 80 },
    "durationMs": { "type": "integer", "minimum": 1, "maximum": 10000 },
    "priority": { "enum": ["hero", "high", "medium", "low"] },
    "assets": {
      "type": "array",
      "maxItems": 16,
      "items": {
        "type": "object",
        "additionalProperties": false,
        "required": ["id", "src", "width", "height"],
        "properties": {
          "id": { "type": "string", "pattern": "^[a-z][a-z0-9-]{1,63}$" },
          "src": { "type": "string", "minLength": 1, "maxLength": 240 },
          "width": { "type": "integer", "minimum": 1, "maximum": 2048 },
          "height": { "type": "integer", "minimum": 1, "maximum": 2048 }
        }
      }
    },
    "bindings": {
      "type": "array",
      "maxItems": 32,
      "items": {
        "type": "object",
        "additionalProperties": false,
        "required": ["param", "layer", "property", "operation"],
        "properties": {
          "param": { "enum": ["intensity"] },
          "layer": { "type": "string" },
          "property": {
            "enum": [
              "spawn.count",
              "spawn.ratePerSecond",
              "motion.speed.min",
              "motion.speed.max",
              "size.start",
              "size.end"
            ]
          },
          "operation": { "enum": ["multiply", "add", "replace"] },
          "min": { "type": "number" },
          "max": { "type": "number" }
        }
      }
    },
    "layers": {
      "type": "array",
      "minItems": 1,
      "maxItems": 8,
      "items": {
        "type": "object",
        "additionalProperties": false,
        "required": ["id", "type", "spawn", "shape", "lifetimeMs", "motion", "size", "opacity"],
        "properties": {
          "id": { "type": "string", "pattern": "^[a-z][a-z0-9-]{1,63}$" },
          "type": { "const": "particles" },
          "delayMs": { "type": "integer", "minimum": 0, "maximum": 10000 },
          "priority": { "enum": ["hero", "high", "medium", "low"] },
          "z": { "type": "number", "minimum": 0, "maximum": 1000 },
          "blend": { "enum": ["normal", "lighter"] },
          "spawn": {
            "oneOf": [
              {
                "type": "object",
                "additionalProperties": false,
                "required": ["mode", "count"],
                "properties": {
                  "mode": { "const": "burst" },
                  "count": { "type": "integer", "minimum": 1, "maximum": 10000 }
                }
              },
              {
                "type": "object",
                "additionalProperties": false,
                "required": ["mode", "ratePerSecond", "durationMs"],
                "properties": {
                  "mode": { "const": "rate" },
                  "ratePerSecond": { "type": "number", "exclusiveMinimum": 0, "maximum": 1000 },
                  "durationMs": { "type": "integer", "minimum": 1, "maximum": 10000 }
                }
              }
            ]
          },
          "shape": {
            "type": "object",
            "additionalProperties": false,
            "required": ["type"],
            "properties": {
              "type": { "enum": ["circle", "square", "image"] },
              "asset": { "type": "string" }
            }
          },
          "color": {
            "oneOf": [
              { "type": "string" },
              { "type": "array", "minItems": 1, "maxItems": 8, "items": { "type": "string" } }
            ]
          },
          "lifetimeMs": { "$ref": "#/$defs/range" },
          "motion": {
            "type": "object",
            "additionalProperties": false,
            "required": ["direction", "spreadDeg", "speed"],
            "properties": {
              "direction": {
                "oneOf": [
                  { "type": "number" },
                  { "const": "inherit" }
                ]
              },
              "spreadDeg": { "type": "number", "minimum": 0, "maximum": 360 },
              "speed": { "$ref": "#/$defs/range" },
              "gravity": { "type": "number", "minimum": -100, "maximum": 100 }
            }
          },
          "size": { "$ref": "#/$defs/curve2" },
          "opacity": { "$ref": "#/$defs/curve2" },
          "rotationDeg": { "$ref": "#/$defs/range" }
        }
      }
    }
  },
  "$defs": {
    "range": {
      "type": "object",
      "additionalProperties": false,
      "required": ["min", "max"],
      "properties": {
        "min": { "type": "number" },
        "max": { "type": "number" }
      }
    },
    "curve2": {
      "type": "object",
      "additionalProperties": false,
      "required": ["start", "end"],
      "properties": {
        "start": { "type": "number" },
        "end": { "type": "number" }
      }
    }
  }
}
